{
  "id": "00000000-0000-4000-8000-000000000001",
  "document_version_id": "00000000-0000-4000-8000-000000000001",
  "content_hash": "0000000000000000000000000000000000000000000000000000000000000000",
  "template_version": "1.0.0",
  "renderer_version": "1.0.0",
  "font_pack_version": "synthetic",
  "format": "pdf",
  "render_model_hash": "0000000000000000000000000000000000000000000000000000000000000000",
  "evidence_manifest_hash": "0000000000000000000000000000000000000000000000000000000000000000",
  "watermark_policy": "discussion",
  "created_by": "00000000-0000-4000-8000-000000000001",
  "created_at": "2026-10-03T00:00:00Z"
}
